{
  "version": 3,
  "supplyOptionsType": "reservation",
  "transactionId": "ABCD-EFGH-IJKL-MNOP",
  "taskId": "160.000.000.000.000.00",
  "name": "Max Mustermann",
  "address": "Musterstra√üe 555",
  "postcode": "55555",
  "city": "Musterhause",
  "country": "DE",
  "hint": "",
  "text": "",
  "phone": "+4912355555555",
  "mail": "mail@mail.mail"
}